{
  "generiert": "akte_klassik",
  "settingId": "nachtexpress",
  "bereich": "erzaehler",
  "hinweis": "Finale im Pfad secretary: finale.secretary.<ende> (4) und rueckblende.secretary.",
  "eintraege": [
    {
      "id": "finale.secretary.ende_meister",
      "text": "Du klagst Greta an, und es stimmt. Du hast die Spuren sauber zusammengetragen. Greta gesteht: Sie kam unter falschem Namen zu Lindqvist und wartete auf diese Nacht. Es ging um eine alte Schuld: Lindqvists Geschäfte haben vor Jahren ein Leben zerstört. Jemand im Zug hat ihm das nie verziehen. Auf der Scheibe von Abteil sieben klebt ein violetter Fleck vom Farbband. Unter dem Deckel der Reiseschreibmaschine liegen Lindqvists Obligationen. Im Nachttee war Schlafpulver, genug für drei Männer. Lindqvist ist eingeschlafen und nicht mehr aufgewacht. Täter, Motiv und Waffe – lückenlos bewiesen. Als die Gendarmerie den Zug betritt, liegt das Geständnis schon unterschrieben im Speisewagen. Greta Falk faltet die Hände im Schoß. „Neun Jahre habe ich seine Briefe getippt“, sagt sie. Mehr sagt sie nicht."
    },
    {
      "id": "finale.secretary.ende_teilerfolg",
      "text": "Du klagst Greta an, und es stimmt. Ein gutes Stück Glück war auch dabei. Greta gesteht: Sie kam unter falschem Namen zu Lindqvist und wartete auf diese Nacht. Es ging um eine alte Schuld: Lindqvists Geschäfte haben vor Jahren ein Leben zerstört. Jemand im Zug hat ihm das nie verziehen. Der richtige Name, aber eine dünne Akte. Ein guter Pariser Anwalt wird daraus ein Kunststück machen. Greta Falk faltet die Hände im Schoß. „Neun Jahre habe ich seine Briefe getippt“, sagt sie. Mehr sagt sie nicht."
    },
    {
      "id": "finale.secretary.ende_justizirrtum",
      "text": "Du klagst die falsche Person an. Wer zu Unrecht beschuldigt wird, ist entsetzt und wütend. Der Speisewagen sitzt danach geteilt da, und die Stimmung wird kalt. Ein Unschuldiger wird in Handschellen durch den Schnee geführt. Der wahre Täter steigt in Paris aus und verschwindet im Morgennebel. In Paris kündigt Greta Falk per Telegramm. Im Speisewagen bleibt ihre Schreibmaschine zurück, ein leeres Blatt eingespannt."
    },
    {
      "id": "finale.secretary.ende_eskalation",
      "text": "Du zeigst auf die falsche Person. Plötzlich reden alle durcheinander. Wer zu Unrecht beschuldigt wird, brüllt zurück, und keiner hört mehr zu. Der Nachtexpress rollt weiter nach Paris – und mit ihm ein Mörder. In Paris kündigt Greta Falk per Telegramm. Im Speisewagen bleibt ihre Schreibmaschine zurück, ein leeres Blatt eingespannt."
    },
    {
      "id": "rueckblende.secretary",
      "text": "Greta tippt bis halb eins Briefe. Dann liest sie heimlich in Lindqvists Mappe. Zwanzig Minuten nach Mitternacht steht sein Nachttee allein in der Bordküche. Greta rührt Schlafpulver hinein. Fünf vor eins kommt der Ruck, und alle Lichter erlöschen. Im Dunkeln lässt sie die Maschine stehen und geht zu Abteil sieben. Am Fenster bleibt ein violetter Fleck zurück. Das leere Tütchen steckt in der Mappe. Das Bündel mit den Obligationen liegt unter dem Deckel ihrer Schreibmaschine."
    }
  ]
}
