{
  "generiert": "akte_klassik",
  "settingId": "nachtexpress",
  "bereich": "erzaehler",
  "hinweis": "Finale im Pfad watchmaker: finale.watchmaker.<ende> (4) und rueckblende.watchmaker.",
  "eintraege": [
    {
      "id": "finale.watchmaker.ende_meister",
      "text": "Du klagst Brändli an, und es stimmt. Du hast die Spuren sauber zusammengetragen. Brändli gesteht: Das Schlafpulver stammt aus seiner eigenen Reisetasche. Es ging ums Geld: Lindqvist reiste mit Inhaberobligationen über ein Vermögen – und die sind verschwunden. Der Täter wollte nie wieder arm sein. Auf dem Fensterbrett von Abteil sieben glänzt ein Tropfen Uhrenöl. Im kalten Herd der Bordküche liegen Lindqvists Obligationen. Im Nachttee war Schlafpulver, genug für drei Männer. Lindqvist ist eingeschlafen und nicht mehr aufgewacht. Täter, Motiv und Waffe – lückenlos bewiesen. Als die Gendarmerie den Zug betritt, liegt das Geständnis schon unterschrieben im Speisewagen. Brändli nimmt die Brille ab und lächelt dünn. In seinem Musterkoffer findet die Gendarmerie Dinge, die keine Uhren sind."
    },
    {
      "id": "finale.watchmaker.ende_teilerfolg",
      "text": "Du klagst Brändli an, und es stimmt. Ein gutes Stück Glück war auch dabei. Brändli gesteht: Das Schlafpulver stammt aus seiner eigenen Reisetasche. Es ging ums Geld: Lindqvist reiste mit Inhaberobligationen über ein Vermögen – und die sind verschwunden. Der Täter wollte nie wieder arm sein. Der richtige Name, aber eine dünne Akte. Ein guter Pariser Anwalt wird daraus ein Kunststück machen. Brändli nimmt die Brille ab und lächelt dünn. In seinem Musterkoffer findet die Gendarmerie Dinge, die keine Uhren sind."
    },
    {
      "id": "finale.watchmaker.ende_justizirrtum",
      "text": "Du klagst die falsche Person an. Wer zu Unrecht beschuldigt wird, ist entsetzt und wütend. Der Speisewagen sitzt danach geteilt da, und die Stimmung wird kalt. Ein Unschuldiger wird in Handschellen durch den Schnee geführt. Der wahre Täter steigt in Paris aus und verschwindet im Morgennebel. Emil Brändli steigt in Zürich aus und wird nie wieder gesehen. Zurück bleibt eine Taschenuhr, die auf die Sekunde genau geht."
    },
    {
      "id": "finale.watchmaker.ende_eskalation",
      "text": "Du zeigst auf die falsche Person. Plötzlich reden alle durcheinander. Wer zu Unrecht beschuldigt wird, brüllt zurück, und keiner hört mehr zu. Der Nachtexpress rollt weiter nach Paris – und mit ihm ein Mörder. Emil Brändli steigt in Zürich aus und wird nie wieder gesehen. Zurück bleibt eine Taschenuhr, die auf die Sekunde genau geht."
    },
    {
      "id": "rueckblende.watchmaker",
      "text": "Brändli sitzt am Klapptisch und poliert Uhrwerke. Kurz nach Mitternacht schleicht er in die Bordküche. Dort rührt er Schlafpulver in Lindqvists Nachttee. Fünf vor eins kommt der Ruck, und alle Lichter erlöschen. Im Dunkeln verlässt Brändli seinen Tisch. Er geht durch den Übergang zu Abteil sieben und nimmt Lindqvists Obligationen. Am Fenster bleibt ein Tropfen Uhrenöl zurück. Das Bündel versteckt er im kalten Herd der Bordküche."
    }
  ]
}
